{
  "$schema": "https://json-schema.org/draft/2020-12/schema",
  "$id": "urn:dungeon-scrivener:schema:v1:player-save",
  "title": "DungeonScrivener portable player save v1",
  "type": "object",
  "$defs": {
    "conversationContext": {
      "type": "object",
      "properties": {
        "conversationId": { "$ref": "urn:dungeon-scrivener:schema:v1:common#/$defs/id" },
        "lineId": { "$ref": "urn:dungeon-scrivener:schema:v1:common#/$defs/id" },
        "returnNodeId": { "$ref": "urn:dungeon-scrivener:schema:v1:common#/$defs/id" }
      },
      "required": ["conversationId", "lineId", "returnNodeId"],
      "additionalProperties": false
    },
    "dialogueHistoryEntry": {
      "oneOf": [
        {
          "type": "object",
          "properties": {
            "kind": { "const": "line-seen" },
            "conversationId": { "$ref": "urn:dungeon-scrivener:schema:v1:common#/$defs/id" },
            "lineId": { "$ref": "urn:dungeon-scrivener:schema:v1:common#/$defs/id" }
          },
          "required": ["kind", "conversationId", "lineId"],
          "additionalProperties": false
        },
        {
          "type": "object",
          "properties": {
            "kind": { "const": "option-selected" },
            "conversationId": { "$ref": "urn:dungeon-scrivener:schema:v1:common#/$defs/id" },
            "lineId": { "$ref": "urn:dungeon-scrivener:schema:v1:common#/$defs/id" },
            "optionId": { "$ref": "urn:dungeon-scrivener:schema:v1:common#/$defs/id" }
          },
          "required": ["kind", "conversationId", "lineId", "optionId"],
          "additionalProperties": false
        }
      ]
    },
    "inventoryStack": {
      "type": "object",
      "properties": {
        "id": { "$ref": "urn:dungeon-scrivener:schema:v1:common#/$defs/id" },
        "owner": { "$ref": "urn:dungeon-scrivener:schema:v1:common#/$defs/stateScope" },
        "itemId": { "$ref": "urn:dungeon-scrivener:schema:v1:common#/$defs/id" },
        "quantity": { "type": "integer", "minimum": 1 },
        "containerStackId": { "$ref": "urn:dungeon-scrivener:schema:v1:common#/$defs/id" },
        "equippedSlot": { "$ref": "urn:dungeon-scrivener:schema:v1:common#/$defs/id" },
        "fields": { "type": "object", "$ref": "urn:dungeon-scrivener:schema:v1:common#/$defs/recordOfScalars", "maxProperties": 10000 }
      },
      "required": ["id", "owner", "itemId", "quantity", "fields"],
      "additionalProperties": false
    },
    "randomOutcome": {
      "type": "object",
      "properties": {
        "ordinal": { "type": "integer", "minimum": 0, "maximum": 16383 },
        "sourceScriptId": { "$ref": "urn:dungeon-scrivener:schema:v1:common#/$defs/id" },
        "provider": { "const": "unseeded" },
        "operation": { "enum": ["float", "integer"] },
        "minimum": { "type": "number" },
        "maximum": { "type": "number" },
        "value": { "type": "number" }
      },
      "required": ["ordinal", "sourceScriptId", "provider", "operation", "value"],
      "additionalProperties": false
    }
  },
  "properties": {
    "format": { "const": "dungeon-scrivener-player-save" },
    "schemaVersion": { "const": 1 },
    "projectId": { "$ref": "urn:dungeon-scrivener:schema:v1:common#/$defs/id" },
    "gameVersion": { "$ref": "urn:dungeon-scrivener:schema:v1:common#/$defs/gameVersion" },
    "engineVersion": { "type": "string", "pattern": "^[0-9]+\\.[0-9]+\\.[0-9]+(?:-[0-9A-Za-z.-]+)?$" },
    "contentFingerprint": { "type": "string", "pattern": "^sha256:[a-f0-9]{64}$" },
    "slotId": { "$ref": "urn:dungeon-scrivener:schema:v1:common#/$defs/id" },
    "slotLabel": { "type": "string", "maxLength": 128 },
    "savedAt": { "type": "string", "format": "date-time" },
    "session": {
      "type": "object",
      "properties": {
        "sceneText": { "type": "object", "properties": { "nodeId": { "$ref": "urn:dungeon-scrivener:schema:v1:common#/$defs/id" }, "text": { "$ref": "urn:dungeon-scrivener:schema:v1:common#/$defs/textSource" }, "appended": { "type": "array", "items": { "$ref": "urn:dungeon-scrivener:schema:v1:common#/$defs/textSource" } } }, "required": ["nodeId", "text"], "additionalProperties": false },
        "currentNodeId": { "$ref": "urn:dungeon-scrivener:schema:v1:common#/$defs/id" },
        "state": {
          "type": "object",
          "properties": {
            "world": { "type": "object", "$ref": "urn:dungeon-scrivener:schema:v1:common#/$defs/recordOfScalars", "maxProperties": 10000 },
            "nodes": {
              "type": "object",
              "maxProperties": 10000,
              "propertyNames": { "$ref": "urn:dungeon-scrivener:schema:v1:common#/$defs/id" },
              "additionalProperties": { "type": "object", "$ref": "urn:dungeon-scrivener:schema:v1:common#/$defs/recordOfScalars", "maxProperties": 10000 }
            },
            "entities": {
              "type": "object",
              "maxProperties": 10000,
              "propertyNames": { "$ref": "urn:dungeon-scrivener:schema:v1:common#/$defs/id" },
              "additionalProperties": { "type": "object", "$ref": "urn:dungeon-scrivener:schema:v1:common#/$defs/recordOfScalars", "maxProperties": 10000 }
            }
          },
          "required": ["world", "nodes", "entities"],
          "additionalProperties": false
        },
        "nodeVisitCounts": {
          "type": "object",
          "maxProperties": 10000,
          "propertyNames": { "$ref": "urn:dungeon-scrivener:schema:v1:common#/$defs/id" },
          "additionalProperties": { "type": "integer", "minimum": 0 }
        },
        "activeConversation": {
          "oneOf": [
            { "$ref": "#/$defs/conversationContext" },
            { "type": "null" }
          ]
        },
        "gameTimeMilliseconds": { "type": "integer", "minimum": 0, "maximum": 9007199254740991 },
        "randomnessMode": { "enum": ["seeded", "unseeded"] },
        "randomSeed": {
          "oneOf": [
            { "type": "integer", "minimum": 0, "maximum": 4294967295 },
            { "type": "null" }
          ]
        },
        "randomOutcomes": { "type": "array", "maxItems": 16384, "items": { "$ref": "#/$defs/randomOutcome" } },
        "randomInitialSeed": {
          "oneOf": [
            { "type": "integer", "minimum": 0, "maximum": 4294967295 },
            { "type": "null" }
          ]
        },
        "ruleGuards": {
          "type": "object",
          "maxProperties": 10000,
          "propertyNames": { "$ref": "urn:dungeon-scrivener:schema:v1:common#/$defs/id" },
          "additionalProperties": { "type": "boolean" }
        },
        "inventory": { "type": "array", "maxItems": 10000, "items": { "$ref": "#/$defs/inventoryStack" } },
        "nextInventoryStackOrdinal": { "type": "integer", "minimum": 0, "maximum": 1000000 },
        "conversationStack": { "type": "array", "maxItems": 64, "items": { "$ref": "#/$defs/conversationContext" } },
        "dialogueHistory": { "type": "array", "maxItems": 16384, "items": { "$ref": "#/$defs/dialogueHistoryEntry" } },
        "entityTags": {
          "type": "object",
          "maxProperties": 10000,
          "propertyNames": { "$ref": "urn:dungeon-scrivener:schema:v1:common#/$defs/id" },
          "additionalProperties": {
            "type": "array",
            "uniqueItems": true,
            "items": { "type": "string", "minLength": 1, "maxLength": 128 },
            "maxItems": 256
          }
        },
        "clockState": {
          "type": "object",
          "properties": {
            "visibility": { "enum": ["visible", "hidden"] },
            "focused": { "type": "boolean" },
            "lastObservedEpochMilliseconds": {
              "oneOf": [
                { "type": "integer", "minimum": 0, "maximum": 9007199254740991 },
                { "type": "null" }
              ]
            },
            "inactiveSinceEpochMilliseconds": {
              "oneOf": [
                { "type": "integer", "minimum": 0, "maximum": 9007199254740991 },
                { "type": "null" }
              ]
            }
          },
          "required": ["visibility", "focused", "lastObservedEpochMilliseconds", "inactiveSinceEpochMilliseconds"],
          "additionalProperties": false
        }
      },
      "required": ["currentNodeId", "state", "nodeVisitCounts", "activeConversation", "conversationStack", "dialogueHistory", "gameTimeMilliseconds", "randomnessMode", "randomInitialSeed", "randomSeed", "randomOutcomes", "ruleGuards", "inventory", "nextInventoryStackOrdinal", "entityTags", "clockState"],
      "additionalProperties": false,
      "allOf": [
        {
          "if": { "properties": { "randomnessMode": { "const": "seeded" } } },
          "then": {
            "properties": {
              "randomSeed": { "type": "integer", "minimum": 0, "maximum": 4294967295 },
              "randomInitialSeed": { "type": "integer", "minimum": 0, "maximum": 4294967295 }
            }
          },
          "else": {
            "properties": { "randomSeed": { "type": "null" }, "randomInitialSeed": { "type": "null" } }
          }
        }
      ]
    }
  },
  "required": ["format", "schemaVersion", "projectId", "gameVersion", "engineVersion", "contentFingerprint", "slotId", "savedAt", "session"],
  "additionalProperties": false
}
