{
  "format": "dungeon-scrivener-player-save",
  "schemaVersion": 1,
  "projectId": "tavern-at-dusk",
  "gameVersion": "1.0.0",
  "engineVersion": "1.0.0",
  "contentFingerprint": "sha256:3333333333333333333333333333333333333333333333333333333333333333",
  "slotId": "slot-one",
  "slotLabel": "Evening",
  "savedAt": "2026-09-23T00:00:00.000Z",
  "session": {
    "currentNodeId": "old-gate",
    "state": {
      "world": {
        "trust": 0
      },
      "nodes": {},
      "entities": {
        "traveler": {
          "mood": "calm"
        }
      }
    },
    "nodeVisitCounts": {
      "old-gate": 1
    },
    "activeConversation": null,
    "conversationStack": [
      { "conversationId": "mira-story", "lineId": "mira-after-return", "returnNodeId": "old-gate" }
    ],
    "dialogueHistory": [
      { "kind": "line-seen", "conversationId": "mira-story", "lineId": "mira-after-return" },
      { "kind": "option-selected", "conversationId": "mira-story", "lineId": "mira-after-return", "optionId": "claim-silver-key" },
      { "kind": "line-seen", "conversationId": "mira-story", "lineId": "mira-farewell" }
    ],
    "gameTimeMilliseconds": 0,
    "randomnessMode": "seeded",
    "randomInitialSeed": 17,
    "randomSeed": 17,
    "randomOutcomes": [],
    "ruleGuards": {},
    "inventory": [],
    "nextInventoryStackOrdinal": 0,
    "entityTags": {
      "traveler": ["known"]
    },
    "clockState": {
      "visibility": "visible",
      "focused": true,
      "lastObservedEpochMilliseconds": null,
      "inactiveSinceEpochMilliseconds": null
    }
  }
}
